[
  {
    "schema_version": "1.1.0",
    "timestamp": "2026-10-30T00:00:00.000Z",
    "service": "companion",
    "instance_id": "00000000-0000-4000-8000-000000000001",
    "sequence": 1,
    "event_id": "00000000-0000-4000-8000-000000000002",
    "level": "WARNING",
    "event": "peer.call.finished",
    "outcome": "failed",
    "correlation_id": "aaaaaaaaaaaaaaaaaaaaaaaaaaaaaaaa",
    "duration_ms": 1,
    "error_code": "forbidden",
    "attributes": {
      "target": "platform",
      "route": "/internal/v1/actor-capabilities/operate",
      "principal": "sha256:bbbbbbbbbbbbbbbbbbbbbbbbbbbbbbbbbbbbbbbbbbbbbbbbbbbbbbbbbbbbbbbb",
      "operation": "query",
      "http_status": 403,
      "error_code": "forbidden",
      "attempt": 1
    }
  }
]
